{
  "schema": 1,
  "id": "scalingllmtest-timecomputeoptimally",
  "title": "Scaling LLM Test-Time Compute Optimally can be More Effective than Scaling Model Parameters",
  "authors": [
    "Charlie Snell",
    "Jaehoon Lee",
    "Kelvin Xu",
    "Aviral Kumar"
  ],
  "venue": "arXiv",
  "year": 2024,
  "url": "https://arxiv.org/abs/2408.03314",
  "added": "2026-08-30",
  "tags": [
    "test-time-compute",
    "inference-scaling",
    "process-reward-models",
    "self-refinement",
    "llm-reasoning",
    "compute-efficiency"
  ],
  "course_links": [],
  "summary": "Adaptively allocating extra computation at inference time, matched to problem difficulty, can outperform a 14× larger pretrained model on easy-to-medium tasks.",
  "thesis": "The optimal way to spend extra compute at inference time depends critically on problem difficulty—easy problems benefit from sequential self-revision while hard problems benefit from parallel search with a verifier. This adaptive 'compute-optimal' strategy achieves 4× better efficiency than naive best-of-N sampling and can substitute for much larger pretrained models on many problem classes.",
  "claims": [
    {
      "tag": "two scaling axes",
      "h": "Test-time compute can be scaled along two independent axes: improving the proposal distribution or optimizing the verifier.",
      "body": [
        "The **proposal distribution** is modified by fine-tuning the model to iteratively revise its own answers in sequence, conditioned on prior incorrect attempts. This is analogous to local search refinement.",
        "The **verifier** (specifically a Process Reward Model, or PRM) assigns correctness scores to each intermediate reasoning step—not just the final answer—allowing tree-search methods like beam search and lookahead search to guide generation toward better solutions.",
        "These two axes are complementary: sequential revisions work better on easier problems already close to the answer, while parallel search with a PRM works better on harder problems requiring broad exploration of solution strategies."
      ]
    },
    {
      "tag": "compute-optimal strategy",
      "h": "Allocating test-time compute adaptively per prompt difficulty improves efficiency by more than 4× over best-of-N sampling.",
      "body": [
        "**Question difficulty** is defined model-specifically as the model's pass@1 rate estimated over 2048 samples, then binned into five quantiles. This per-model difficulty estimate is more predictive of test-time compute effectiveness than the dataset's hand-labeled difficulty.",
        "A **compute-optimal scaling strategy** selects the hyperparameters (e.g., sequential-to-parallel ratio, beam width) that maximize accuracy for a given difficulty bin and compute budget, chosen on a validation fold and applied to a held-out test fold.",
        "Using this strategy, the compute-optimal approach matches or exceeds best-of-N performance using approximately 4× fewer generated samples in both the revision and PRM-search settings."
      ]
    },
    {
      "tag": "vs. pretraining scaling",
      "h": "On easy and medium problems, test-time compute can substitute for training a model 14× larger, but not on the hardest problems.",
      "body": [
        "A **FLOPs-matched evaluation** compares a smaller model with added inference compute against a model with ~14× more parameters using greedy decoding. Pretraining FLOPs are approximated as 6ND and inference FLOPs as 2ND, where N is parameter count and D is token count.",
        "For easy and intermediate difficulty problems, or when inference demand is low relative to pretraining (R << 1), compute-optimal test-time scaling with the smaller model outperforms the larger pretrained model.",
        "On the hardest problems or when inference volume is high (R >> 1), the larger pretrained model is preferable, showing that test-time and pretraining compute are not universally interchangeable."
      ]
    },
    {
      "tag": "verifier search behavior",
      "h": "Beam search over a PRM outperforms best-of-N at low budgets but degrades at high budgets due to verifier exploitation.",
      "body": [
        "**Beam search** prunes candidates at each reasoning step using PRM scores, concentrating compute on promising solution paths. It significantly outperforms best-of-N at small generation budgets but underperforms at large budgets.",
        "The degradation at high budgets is attributed to **verifier exploitation**: the search over-optimizes spurious features in the PRM, sometimes producing repetitive low-information steps or unnaturally short solutions.",
        "**Lookahead search**, which rolls out k additional steps before scoring each beam candidate, further amplifies this exploitation and consistently underperforms beam search at equal compute cost."
      ]
    },
    {
      "tag": "limitations and honesty",
      "h": "The study has several practical limitations that the authors openly acknowledge.",
      "body": [
        "Estimating question difficulty requires running 2048 model samples per problem, which itself is a substantial compute cost that is not accounted for in the efficiency comparisons presented.",
        "The hardest problems (difficulty bin 5) show little benefit from any test-time compute strategy tested, and no current method bridges this gap—more pretraining appears necessary for such problems.",
        "The revision model required task-specific fine-tuning because off-the-shelf LLMs cannot self-correct on reasoning tasks; the authors note this is a current limitation but expect future models to develop this capability through pretraining."
      ]
    }
  ],
  "concepts": [
    {
      "t": "Test-Time Compute",
      "plain": "This is extra computation spent by an AI model while answering a question, after training is already finished. Instead of just generating one answer instantly, the model uses more processing cycles to search for or refine a better answer. Think of it as letting the model 'think harder' on demand.",
      "eng": "During inference, rather than a single forward pass producing a greedy output, the system performs multiple forward passes — either generating many candidate answers in parallel, or generating them sequentially where each pass conditions on prior outputs. The computational cost scales with the number of generated tokens, governed by the approximation Y = 2ND_inference where N is parameter count. The key caveat is that the benefit per added compute unit diminishes differently depending on problem difficulty, so naive uniform scaling is wasteful."
    },
    {
      "t": "Process Reward Model (PRM)",
      "plain": "A PRM is a separately trained neural network that scores not just the final answer of a math solution, but every intermediate step along the way. This per-step scoring lets the system prune bad reasoning paths early, rather than only finding out a solution was wrong at the end. It acts like a quality inspector checking each stage of an assembly line.",
      "eng": "An ORM (Outcome Reward Model) scores only the terminal answer, whereas a PRM produces a correctness probability estimate at each reasoning step — effectively a value function estimating reward-to-go from that intermediate state. The PRM in this paper is trained via Monte Carlo rollouts: from each step, many completions are sampled and the empirical fraction that reach a correct final answer becomes the soft training label. The practical caveat is that a PRM trained on outputs from one model (e.g., GPT-4) degrades when applied to a different model's outputs due to distribution shift, requiring retraining on the target model's own samples."
    },
    {
      "t": "Best-of-N Sampling",
      "plain": "Best-of-N means generating N independent candidate answers and then picking whichever one a scoring function rates highest. It is the simplest way to use extra compute at test time: just run the model N times in parallel. The downside is that all N attempts are independent — they do not learn from each other.",
      "eng": "Best-of-N is embarrassingly parallel: N complete solutions are sampled i.i.d. from the model's distribution, then a verifier selects the top-scoring one. The 'weighted' variant aggregates verifier scores across all candidates sharing the same final answer before selecting, which reduces sensitivity to individual scoring noise. Scaling behavior follows a log-linear improvement curve that eventually saturates, and on problems where the base model's pass@1 is near zero, no amount of best-of-N sampling helps because the correct answer is never in the candidate set."
    },
    {
      "t": "Beam Search over a PRM",
      "plain": "Beam search is a tree-structured search where at each reasoning step you keep only the top-K partial solutions according to the PRM score, and expand those further. Unlike best-of-N which builds complete answers independently, beam search prunes bad paths mid-solution to focus compute on promising directions. It trades breadth for depth in the search.",
      "eng": "The algorithm maintains a fixed beam of N partial solutions; at each step M new continuations are sampled per beam element, the PRM scores all N×M partial solutions, and only the top N are retained. Lookahead search extends this by rolling out k additional steps before scoring each candidate, giving a better value estimate at the cost of k+1× more compute per step. The critical failure mode is reward hacking: on easy problems where the PRM is already accurate, aggressive beam search over-optimizes spurious PRM features, generating degenerate outputs (e.g., repetitive low-information steps) while achieving high PRM scores."
    },
    {
      "t": "Sequential Revisions (Proposal Distribution Refinement)",